text,Reeshan - eval,Reeshad - actionable,Divyansh - eval,Divyansh - actionable,Kirtan
"We can imagine a Calgary where cycling conditions across the city are safe enough that the majority of citizens could choose cycling once a week, for short local trips. Totally achievable, with myriad knock-on benefits, requiring relatively modest investments in #yycbike network. https://t.co/0vTahhEFOz",T,FA,y,n,T
In Vancouver bike lanes are wider than traffic lanes #yycbike #yvrbike https://t.co/7K1Ea0fDEd,T,FA,y,n,T
"@ASKdesignCSI I’ll be back to visit. Hope to be pleasantly surprised by the increase in bicycle infrastructure. Actually, also kinda hoping a pathway from Nelson to Calgary will be built. 😬#dreams #yycbike",T,FA,y,n,T
"It matters not how far Boston is from Calgary, I celebrate every bike infrastructure improvement. Good ideas spread. Today's win in Boston is tomorrow's win in Halifax and then Ottawa, Toronto, Winnipeg, and Calgary after that.👏👏👏 https://t.co/DBhychHAUL",T,FA,y,n,T
"@morganlanigan Yup.

Traffic Calming and bike lanes don't need to be expensive.

Even Calgary has a much larger budget, they still spend it wisely:
https://t.co/v6vAg8o1ya",T,FA,n,-,
"Alert, the bike talk in Calgary is heating up: Great collection in the article - awesome rides!  Greenway at the north end is down to 1.5 km gravel to get under Stoney... check out the Calgary Bike &amp; Pathways app for up to date trail status info - closures, construction, etc. htt",T,FA,y,n,T
"#yyc #yyccc @CBCEyeopener @bikecalgary #yycbike 

@electrobarn we should schedule a date for Calgary biking supporters to go canvas @seanchucalgary’s ward before the election. 

The guys not fit to serve on council - bikers would be doing Calgarians a BIG favour! @DuaneBratt https://t.co/svZcCiwIWm",T,TA,n,-,
"With restrictions lifting, look at how busy Calgary's pathways are. #yyc https://t.co/nnEVcsXixO",T,FA,y,n,T
"@alex_benzie @Cobylefko Here's the developer's website w/ plans. There are 20 homes with 20 garages and 2 visitor parking stalls along the lane (is calling them 'stalls' unique to Calgary?). It looks like the location's walk score is 34, transit score is 40, and bike score is 81.
https://t.co/YoO0XXZDCB",T,FA,n,-,
"Planning on testing out how ""great"" our #Calgary pathways are. I've heard from many the moment you cross over Deerfoot, it all goes to shit. #WorldBicycleDay #DeerfootDivide",T,FA,y,n,T
Not too impressed with the bike rack situation at the Calgary Co-op on 85th St SW @CalgaryCoop #yycbike https://t.co/xR7zzzEZjs,T,FA,y,y,T
It sounds like Airdrie is doing some studies on a bike pathway to Calgary. Connecting through #Ward3yyc to the Ward 4 Nose Creek Pathways sucks. Candidates - how will you champion Nose Creek pathway connectivity in Ward 3? @jasmine_mian @gurbirward3 @NatePike @BrentTrenholm https://t.co/vrrXqXsvxT,T,FA,y,y,T
"It’s great to see Calgarians expending some of their pent-up energy by getting outside and being active! And, because we’re opening up streets like Memorial Drive to people, they can spill out from busy pathways and still stay physically distanced. #yycwalk #yycbike https://t.co/Op0tspiYWb",T,FA,y,n,T
Pretty treacherous on the sidewalks in downtown Calgary right now. Better to ride your bike. https://t.co/jhzCNjU85F,T,FA,y,n,T
@PopsCerealStan Here in Canada (Calgary) we have bike lanes and they actually share road lights so they get their own turning signal.,T,FA,y,n,T
"This is perfectly fine, because why would anyone bike 3km to get to a bike trail in Calgary?",T,FA,y,n,T
Has there been a significant shift to cycling as a mode share into downtown (as people avoid transit etc)? Could also be an increase in recreational rides travelling through the core? #yycbike #yyccc,T,FA,y,y,T
@CoryBMorgan Stalk Calgary’s bike lanes for a likely victim 😂,T,FA,y,n,T
"Care about how your communities can help change our city? Tomorrow night is the turn of Mission - Cliff Bungalow and there are many different organizations supporting this conversation, including Bike Calgary! https://t.co/2iyOdPRMpt",T,FA,y,n,T
"THE GUNN SHOW:

Residents of Calgary and Edmonton have voted for more bike lanes, bad art, lower speed limits, higher taxes and expanded recycling programs.

@SheilaGunnReid speaks with @wmcbeath

https://t.co/8YNVecwmVh",T,FA,n,-,
"A beautiful 1eh day #bowvalleyparkway #banff #cyclingbanff #yycbike #cervelo #mybike #cervelocaledonia #castlemountain #roadslikethese @ Banff, Alberta https://t.co/LEiDcerwI6",T,FA,n,-,T
"When I first got to Halifax, I found cycling a bit stressful. I was definitely spoiled by Calgary's incredible bike network. But I've been pushing myself to keep getting out there and finding pathways, roads, bridges, ferries, and yes, sidewalks, that work for me! https://t.co/kuJH7skSHk",T,FA,y,n,T
"Calgary project turns kids into urban planners to improve transportation.  Active school commutes help traffic, well-being and the environment. https://t.co/tGx6ldJifN @SustainableYYC #yyccc #yycroads #yycbike",T,FA,y,n,ta
"@CoryBMorgan Downtown driving in Calgary on a dark winter morn dodging the bike riders who do whatever they like, whenever they like, wherever they like. Not all, but many. A poorly managed sh1t show that did more to create chaos than a good green initiative.",T,FA,y,n,T
"@ShawnMenard1 Our street looks like it was hit by a meteor shower. Please compare tax rates to places like Calgary, Edmonton, Winnipeg, which all do not have the NCC managing huge bits of their infrastructure, yet have bike paths etc. and lower taxes by a huge margin.",T,TA,y,y,T
@yyc_roman @brettbergie when dozens or hundreds of cars have to wait so one cyclist can go first at a green light is a clear disadvantage. Whoever designed Calgary's bike lane was both incompetent and ineffective. Clearly that's the case given the poor planning. Or they don't want people using cars. :(,T,FA,y,n,ta
"@rwmacleod @dwallacewells @ElizabethMay Calgary, Alberta (where we are headquartered) has hundreds of kms of bike lanes - perfect for 1/2 the year for fit people. Not so much in winter. https://t.co/9UjbWt7bUD",T,FA,y,y,T
"Choosing to cycling once a week offers Calgary a huge transport emissions reduction opportunity. 

Calgary needs to make it easier for people to choose safe cycling for everyday errands. #yycbike https://t.co/VOJiy4OAl8",T,TA,n,-,
@missurbanist Love this.  Sunday I took a ride through my old suburbian hell neighborhood.  My soon-to-be ex-wife and I lived there for 5 years and hated it.  Transit to downtown Calgary from here is 1 hour 45 minutes.  Ha ha.   From my new place I bike downtown in about 7 minutes. https://t.co/0XQEkWOPAh,T,FA,y,y,T
"S/O to the #yycbike guys and gals on fat bikes who forged through the snow before me. I take this shortcut past Calgary's second tallest tower. Also, pathway beside Zoo on north side of the Bow is still snowpacked. https://t.co/IqulC0LUzL",T,TA,y,y,T
@S_HastingsSimon And ignore the signed 10 km/h speed limit segments on Calgary pathways. 👍,T,FA,y,n,T
"@bikecalgary #Calgary needs more of this. Also, where can low income people get a bike?🤔 https://t.co/zSMEzcpxht",T,TA,y,n,T
"@drdagly Standing on 14th St &amp; 50th Av NW in Calgary, I looked up, &amp; there was a person about 20ft in the air. It's a place where there's a downhill stretch of bike path, &amp; no sightlines for cars entering 14th St from alleys. A recipe for disaster in a town where nobody follows this rule.",T,FA,y,y,T
"Also 3 months of the year, the average daily high temperature is below freezing, and Calgary typically gets a decent amount of snow. If Calgary, the literal oil/gas headquarters of Canada, can build bike lanes to facilitate reductions in car travel, why can't your city?",T,TA,y,n,T
"@Franktmcveety And yet the City of Calgary divvy up all the streets of Calgary for the workforce, that has been greatly reduced. If I see one person in a bike lane, it’s too much 😳",T,FA,y,n,T
"The pandemic hit all city centres who rely heavily on suburban commutes &amp; single modes of transport extra hard. So Calgary's new downtown strategy is to spark way more residential conversions, bike lanes &amp; green space.  @DowntownWpgBIZ @centreventure. https://t.co/HJksOLHtQK",T,FA,y,n,T
"I rode my bike up the worst stroad in my city (Macleod Trail) to get to the heart of its loathsomeness. Come along for the ride.
#yycbike #yegbike #velomtl #bikeTo #yvrbike #bikenyc #bikewpg
https://t.co/uZgOMBjZnQ",T,FA,n,-,
@SaveCalgary I hope the winning candidate knows the ONLY way to revitalize downtown YYC is to triple the bike lanes and charge the same extortionist parking fees to the climate saving pedal bikes. Calgary - Be Part of the energy - Literally,T,TA,y,n,T
Jonathan van Heyst with Bike Calgary is urging council to boost spending on snow and ice clearing for sidewalks and pathways to ensure safety for pedestrians/cyclists and Calgarians with disabilities. Bike Calgary says snow clearing is a top issue.,T,TA,y,n,T
"Hmm, this seems odd. Calgary and Edmonton more bike-friendly than Vancouver or Victoria? Awaiting commentary on this. https://t.co/J4E6mPFwB9",T,FA,y,n,T
"You know what that means #yycbike? You can ride from Lake Louise to the closure and back and there's barely any traffic. Link it up with the 1A too, if you've got the legs! https://t.co/cbRddBRVII",T,FA,y,n,T
"@DSBW2MM Is the 40km max only for motor vehicles or does it include bikes? Do riders follow the rules of the road? Where are the bike lanes? If Palm Springs can have dedicated bike lanes in every neighbourhood, so can Calgary! Time to licence bike riders, issue plates &amp; require insurance.",T,TA,y,y,T
"Bright illustrations of cycling animals along bike route meant to slow traffic and bring colour to Crescent Heights, Renfrew - Calgary Herald #Calgary #Transit #YYC https://t.co/5tcEuJfVjX",T,FA,y,n,T
"My friend Nathaniel is cycling across Canada &amp; chose Calgary on his adventure'

#dyk Calgary has 1000+ km of urban pathways? His blog:  https://t.co/desoqRcZZS

Explore my platform: https://t.co/B1EmZQGDEA 

#ward5 #yyccc #calgary #election #oct18 #votemerali #voteyyc https://t.co/ACQIre8AT0",T,FA,n,-,
"Would anyone be interested in helping me set up a map of those frustrating bike gates on Calgary paths? I'm not the techiest, but I would love to piece together where these are so we can advocate for safer and wheel-friendly replacements.",T,TA,y,n,T
@brent_bellamy Too bad Winnipeg tore up most of its railway lines and never put in light rail trains like Edmonton and Calgary on them. One goes right up Gateway now it’s a bike and foot path that goes miles! Could have been a great LRT. Plus many others,T,FA,n,-,T
"@NickPiers @CBCNS Calgary is pretty decent for that, lots of bike lanes and such",T,FA,y,n,T
"@ellejayjoseph Fascinating stats, thank you. I’d love to see the trails extend to the communities around Calgary as well. Believe it or not, #Airdrie has an active cycling community wanting pathways into Calgary, but there are no safe connections. Who wants to ride on the shoulder of qe2?",T,TA,y,y,T
1/ What frameworks and resources currently exist in Calgary for improving the walkability and accessibility of our neighbourhoods? @cityofcalgary @jyotigondek @jeromyYYC @bradfieldyyc @jandameryYYC #yyccc #yyc #yycwalk #yycbike,T,TA,y,n,T
"@Chealion @Princess_Jules @yyctransport Princess Jules, people who cycle more than drive subsidize drivers with the property taxes they pay. Taxes pay for car infrastructure orders of magnitude more than they pay for #yycbike infrastructure. Plus we don’t collect enough taxes to fully pay for the roads we have.",T,FA,y,y,T
"@DaleCalkins @bpincott @JyotiGondek @JeffDavisonYYC @cityofcalgary It is a shame to think that the city of Calgary won't offer more bike parking racks despite spending more than $300 M on the New Flames arena.

Hoping that maybe new city council can fix this.",T,TA,n,-,
"@KyleTWN @private83186729 Also shows that we have LOTS of pathways in Calgary - downtown ones by the river tend to be crowded ""The City maintains approximately 1000 km of regional pathways and 96 km of trails."" https://t.co/71C7KAEvTH",T,FA,y,n,T
"Would be great if cul-de-sac signs in Calgary could indicate when a through connection exists (via pathway or walkway) for people walking or cycling.

https://t.co/AB7bXDcxDR

#yycplan #yycbike",T,TA,n,-,
"@doug_schweitzer @nenshi good riddens!.you have damaged the entrepreneurship and business in our city and destroyed downtown. Your bike lanes and heavy increases in business taxes have resulted in businesses leaving downtown in droves, and Calgary as a whole. Reckless spending &amp; ridiculous taxes",T,FA,y,n,T
"@TinyBeaches Definitely. And, IMO Calgary needs to re-institute the position of Cycling Coordinator, with a cross-department mandate, i.e. so the role covers bikeways &amp; pathways. They then need to hire a great candidate, like before.",T,TA,y,y,ta
@liveablestreets @DaleCalkins Now someone just needs to explain the difference between the red bike paths in Canmore and the red decorative concrete that looks like bike paths on some Calgary road &amp; sidewalk projects. 🤔,T,TA,y,n,T
Great overview - have you seen the kind of institutional inertia described in Calgary preventing something like this from getting off the ground? Friends have used bike index but I guess I’m skeptical it helps nearly as much without wider buy-in. https://t.co/3TQkUdGliL,T,FA,y,n,T
"Another awesome video from @TomBabin: How disconnected bicycle routes are ruining the bike-friendliness... https://t.co/Y09QShrdIC 

His Edmonton Tr example was on the top of my list! 🚲 #YYCBike",T,FA,n,-,
"Alert, the bike talk in Calgary is heating up: DJ_Holly_D edmontonjournal A bit dramatic there.  We’re not locked in our houses.  We can still go grab essentials, can still go for walks/bike rides/car rides.  We’re just being asked to do a small thing to help our fellow Canadians",T,FA,y,n,T
This seems like a logical next step for @yyctransport in Calgary to take to build on the 5A network principles and 5A network map in the Calgary Transportation Plan.  #yycbike,T,FA,y,y,ta
"@yycbikeguy Yes but not in the early morning. You can’t take your bike on. C-train then, or at your convenience in the early evening. Why is this @cityofcalgary ? Time for change? #yycbike",T,TA,y,n,ta
"Alert, the bike talk in Calgary is heating up: stukehrig bikeedmonton Welcome back to the joyful world of bike rides!Alan (vaccinated) SchtweetziWeb, iBike, iThink. Web/Social Media/Comms/Journalism dude, ex-pro photographer, past prez of Alberta Bicycle Assn. + EBTC, domesticate",T,FA,y,n,T
Here is a video of my family trying to run an errand by bike along Calgary Trail and Gateway Blvd. It's so terrible and feels violent. Why don't more people cycle? #yeg #yegcc @pathsforppl @AmarjeetSohiYEG #yegbike https://t.co/nZBEusBHqA,T,FA,y,n,T
"@BromptoningLove @LanrickBennett @metromorning @BikewaysTO @biketo Salute from Calgary, where well maintained pathways and bikeways keep my family and me rolling through winter for work, errands, and pleasure. https://t.co/W7KMFjNE1s",T,FA,y,n,T
"@JaniceTheriault @InsiderOilers @sjcalgary When I lived in Calgary,  I looked up the cost for those bike lanes. It worked out to $1.27 per $1000 of property taxes paid...and that is not just for bike lanes, but also improvements to pedestrian corridors. We pay more for a ☕ than we do to keep those outside of cars safe.",T,FA,y,y,T
Liked on YouTube: Bike-friendly city showdown compares Amsterdam with Calgary | Collab with @Not Just Bikes https://t.co/40likJTEr5,T,FA,y,n,T
"BIKE RECOVERY: ""The community, Bike Index, and Calgary Police."" @BikeIndexCalg #bikeyyc @salsacycles https://t.co/Tmx0HT2I7n",T,FA,n,-,T
"Oh god. I'm watching a video comparing bike rides in Calgary and Amsterdam, and,,,,,

Damn. Just seeing the comparison between the bike infrastructure/street design/&amp;c. is.

Huh. Wow. that's definitely one thing they *do* do better.",T,FA,n,-,
"@Canadabuster Shutdown and Lockdown the Calgary International Airport.  
Vehicle travel on the Queen E2 will be on alternating days North and South.  
Build Back Better With Bike Lanes !!!",T,TA,n,-,
"Calgary is a great example of a city that has invested significantly in bike infrastructure. AND I DON’T MEAN THE BARE BONES, SUPER-INEXPENSIVE CYCLE TRACKS DOWNTOWN (that I love!). I mean the massive bike path network that connects pretty much the entire city.",T,FA,y,n,T
"@brian_gettler @tpcanoe @ianmilligan1 I expect Victoria and Vancouver are ahead of the curve as well. In Saskatoon we elected ""bike lane"" Charlie and after 1.25 terms we have negative one bike lane downtown. But we're obviously an outlier lagging behind Edmonton and Calgary.",T,FA,y,n,T
,,,,,T
